{
  "$schema": "https://json-schema.org/draft/2020-12/schema",
  "$id": "https://example.org/trqp-assurance_hub/combined-assurance-manifest.schema.json",
  "title": "Combined Assurance Manifest",
  "description": "Machine-readable manifest produced by the combined-assurance workflow, capturing build provenance, tool versions, run identifiers, and evidence artifact references for a given assurance run.",
  "type": "object",
  "required": [
    "manifest_version",
    "generated_at",
    "build",
    "tools",
    "artifacts"
  ],
  "properties": {
    "manifest_version": {
      "type": "string"
    },
    "generated_at": {
      "type": "string"
    },
    "build": {
      "type": "object",
      "required": [
        "build_id",
        "target",
        "run_id",
        "target_id"
      ],
      "properties": {
        "build_id": {
          "type": "string"
        },
        "target": {
          "type": "string"
        },
        "run_id": {
          "type": "string"
        },
        "target_id": {
          "type": "string"
        },
        "commit": {
          "type": "string"
        },
        "ci_run_url": {
          "type": "string"
        },
        "target_state": {
          "type": "object",
          "required": [
            "algorithm",
            "digest",
            "identity",
            "source",
            "status"
          ],
          "properties": {
            "algorithm": {
              "const": "sha256"
            },
            "digest": {
              "type": "string",
              "pattern": "^[a-f0-9]{64}$"
            },
            "identity": {
              "type": "string",
              "pattern": "^sha256:[a-f0-9]{64}$"
            },
            "source": {
              "type": "string",
              "minLength": 1
            },
            "status": {
              "const": "verified"
            }
          },
          "additionalProperties": false
        }
      },
      "additionalProperties": false
    },
    "tools": {
      "type": "object",
      "required": [
        "trqp_conformance_suite",
        "trqp_tspp"
      ],
      "properties": {
        "trqp_conformance_suite": {
          "type": "object",
          "required": [
            "version",
            "profile_id",
            "run_id"
          ],
          "properties": {
            "version": {
              "type": "string"
            },
            "profile_id": {
              "type": "string"
            },
            "run_id": {
              "type": "string"
            }
          },
          "additionalProperties": false
        },
        "trqp_tspp": {
          "type": "object",
          "required": [
            "version",
            "assurance_level",
            "run_id"
          ],
          "properties": {
            "version": {
              "type": "string"
            },
            "assurance_level": {
              "type": "string",
              "enum": [
                "AL1",
                "AL2",
                "AL3",
                "AL4"
              ]
            },
            "run_id": {
              "type": "string"
            }
          },
          "additionalProperties": false
        }
      },
      "additionalProperties": false
    },
    "artifacts": {
      "type": "array",
      "minItems": 1,
      "items": {
        "type": "object",
        "required": [
          "kind",
          "path"
        ],
        "properties": {
          "kind": {
            "type": "string"
          },
          "path": {
            "type": "string"
          },
          "produced_by": {
            "type": "string"
          },
          "media_type": {
            "type": "string"
          },
          "format": {
            "type": "string"
          },
          "notes": {
            "type": "string"
          },
          "sha256": {
            "type": "string"
          }
        },
        "additionalProperties": false
      }
    },
    "generator": {
      "type": "object",
      "properties": {
        "name": {
          "type": "string"
        },
        "version": {
          "type": "string"
        },
        "uri": {
          "type": "string"
        }
      },
      "additionalProperties": false
    },
    "lifecycle": {
      "type": "object",
      "description": "Lifecycle and revocation publication state associated with the evaluated target.",
      "required": [
        "state"
      ],
      "properties": {
        "state": {
          "type": "string",
          "enum": [
            "draft",
            "active",
            "suspended",
            "deprecated",
            "revoked",
            "retired",
            "unknown"
          ]
        },
        "status_feed_uri": {
          "type": "string"
        },
        "revocation_supported": {
          "type": "boolean"
        },
        "sla_seconds": {
          "type": "integer",
          "minimum": 0,
          "maximum": 31536000
        },
        "last_checked_at": {
          "type": "string"
        }
      },
      "additionalProperties": false
    },
    "tsmm_mapping": {
      "type": "object",
      "description": "Optional semantic mapping from the assurance run to TSMM concepts so authority, delegation, evidence, lifecycle, decision, and effect are explicit.",
      "properties": {
        "model_version": {
          "type": "string"
        },
        "governance_context": {
          "type": "string"
        },
        "authority": {
          "type": "object",
          "properties": {
            "authority_id": {
              "type": "string"
            },
            "authority_type": {
              "type": "string"
            },
            "delegation_scope": {
              "type": "string"
            },
            "scope_limitations": {
              "type": "array",
              "items": {
                "type": "string"
              }
            }
          },
          "additionalProperties": false
        },
        "evidence": {
          "type": "array",
          "items": {
            "type": "object",
            "required": [
              "artifact_kind",
              "produced_by"
            ],
            "properties": {
              "artifact_kind": {
                "type": "string"
              },
              "produced_by": {
                "type": "string"
              },
              "supports_claim": {
                "type": "string"
              }
            },
            "additionalProperties": false
          }
        },
        "decision": {
          "type": "object",
          "properties": {
            "decision_type": {
              "type": "string"
            },
            "effect": {
              "type": "string"
            },
            "policy_basis": {
              "type": "string"
            }
          },
          "additionalProperties": false
        }
      },
      "additionalProperties": false
    },
    "tis_artifacts": {
      "type": "object",
      "description": "Optional references to Trust Infrastructure Schemas artifact contracts used by the assurance run.",
      "properties": {
        "tis_version": {
          "type": "string"
        },
        "evidence_bundle_manifest": {
          "$ref": "#/$defs/artifactReference"
        },
        "conformance_declaration": {
          "$ref": "#/$defs/artifactReference"
        },
        "decision_receipt": {
          "$ref": "#/$defs/artifactReference"
        },
        "registry_publication": {
          "$ref": "#/$defs/artifactReference"
        },
        "status_or_revocation_evidence": {
          "$ref": "#/$defs/artifactReference"
        }
      },
      "additionalProperties": false
    },
    "summary": {
      "type": "object",
      "properties": {
        "overall_status": {
          "type": "string",
          "enum": [
            "pass",
            "fail",
            "partial"
          ]
        },
        "conformance_status": {
          "type": "string",
          "enum": [
            "pass",
            "fail",
            "partial"
          ]
        },
        "tspp_status": {
          "type": "string",
          "enum": [
            "pass",
            "fail",
            "partial"
          ]
        },
        "notes": {
          "type": "string"
        },
        "posture_score": {
          "type": "number",
          "minimum": 0,
          "maximum": 100
        },
        "coverage_index": {
          "type": "number",
          "minimum": 0,
          "maximum": 100
        },
        "evidence_completeness": {
          "type": "number",
          "minimum": 0,
          "maximum": 100
        },
        "assurance_tier": {
          "type": "string",
          "enum": [
            "AL1",
            "AL2",
            "AL3",
            "AL4"
          ]
        }
      },
      "additionalProperties": false
    }
  },
  "additionalProperties": false,
  "$defs": {
    "artifactReference": {
      "type": "object",
      "required": [
        "schema",
        "path"
      ],
      "properties": {
        "schema": {
          "type": "string"
        },
        "path": {
          "type": "string"
        },
        "sha256": {
          "type": "string"
        },
        "notes": {
          "type": "string"
        }
      },
      "additionalProperties": false
    }
  }
}
