{
  "manifest_version": "0.2.0",
  "generated_at": "2026-04-16T00:00:00Z",
  "build": {
    "build_id": "opstack-demo-001",
    "target": "https://directory.example.org",
    "run_id": "opstack-demo-001",
    "target_id": "demo-directory",
    "target_state": {
      "algorithm": "sha256",
      "digest": "b08df601c3bee38e5906de49e1fac43845f17186f7056e6778a3a0fe9b8fadad",
      "identity": "sha256:b08df601c3bee38e5906de49e1fac43845f17186f7056e6778a3a0fe9b8fadad",
      "source": "examples/operational-stack/state-snapshot.json",
      "status": "verified"
    }
  },
  "tools": {
    "trqp_conformance_suite": {
      "version": "1.2.1",
      "profile_id": "interop_demo",
      "run_id": "opstack-demo-001"
    },
    "trqp_tspp": {
      "version": "0.10.1",
      "assurance_level": "AL1",
      "run_id": "opstack-demo-001"
    }
  },
  "artifacts": [
    {
      "kind": "conformance_report",
      "path": "conformance/cts-report.json",
      "produced_by": "trqp_conformance_suite",
      "media_type": "application/json",
      "format": "cts-report-v0"
    },
    {
      "kind": "posture_report",
      "path": "posture/tspp-report.json",
      "produced_by": "trqp_tspp",
      "media_type": "application/json",
      "format": "tspp-report-v0"
    },
    {
      "kind": "stack_run_metadata",
      "path": "metadata/stack-run.json",
      "produced_by": "trqp_assurance_hub",
      "media_type": "application/json",
      "format": "operational-stack-run-v0"
    },
    {
      "kind": "assurance_profile",
      "path": "profiles/al2-verified.yaml",
      "produced_by": "trqp_assurance_hub",
      "media_type": "application/yaml",
      "format": "assurance-profile-v1"
    }
  ],
  "generator": {
    "name": "trqp-assurance-hub:generate-manifest",
    "uri": "https://github.com/sankarshanmukhopadhyay/trqp-assurance-hub"
  },
  "summary": {
    "overall_status": "pass",
    "conformance_status": "pass",
    "tspp_status": "pass",
    "assurance_tier": "AL1"
  }
}
