{
  "manifest_version": "0.2.0",
  "generated_at": "2026-01-15T00:00:00Z",
  "build": {
    "build_id": "al2-mvb-example-abc1234",
    "target": "https://registry.example.org",
    "run_id": "run-abc1234",
    "target_id": "https://registry.example.org",
    "ci_run_url": "https://github.com/example/registry/actions/runs/12345"
  },
  "tools": {
    "trqp_conformance_suite": {
      "version": "1.1.0",
      "profile_id": "baseline",
      "run_id": "cts-run-abc1234"
    },
    "trqp_tspp": {
      "version": "0.9.0",
      "assurance_level": "AL2",
      "run_id": "tspp-run-abc1234"
    }
  },
  "artifacts": [
    {
      "kind": "conformance_report",
      "path": "conformance/cts-report.json",
      "produced_by": "trqp_conformance_suite",
      "media_type": "application/json"
    },
    {
      "kind": "conformance_evidence_bundle_zip",
      "path": "conformance/bundle.zip",
      "produced_by": "trqp_conformance_suite",
      "media_type": "application/zip"
    },
    {
      "kind": "evidence_bundle_checksums",
      "path": "conformance/checksums.json",
      "produced_by": "trqp_conformance_suite",
      "media_type": "application/json"
    },
    {
      "kind": "posture_report",
      "path": "posture/tspp-report.json",
      "produced_by": "trqp_tspp",
      "media_type": "application/json"
    },
    {
      "kind": "version_tuple",
      "path": "version-tuple.json",
      "produced_by": "operator",
      "media_type": "application/json"
    }
  ],
  "summary": {
    "overall_status": "pass",
    "conformance_status": "pass",
    "tspp_status": "pass",
    "coverage_index": 100.0,
    "posture_score": 100.0,
    "assurance_tier": "AL2",
    "notes": "AL2 minimal viable bundle example. Checksums present; no independent assessor required at AL2."
  },
  "generator": {
    "name": "trqp-assurance-hub:generate-manifest",
    "uri": "https://github.com/sankarshanmukhopadhyay/trqp-assurance-hub"
  }
}
