{
  "manifest_version": "0.1.0",
  "generated_at": "2026-03-09T00:00:00Z",
  "build": {
    "build_id": "example-build-abc123",
    "target": "https://registry.example.org",
    "commit": "abc123def456",
    "ci_run_url": "https://github.com/example/trqp-assurance-hub/actions/runs/1",
    "run_id": "example-run-001",
    "target_id": "example-target-001"
  },
  "tools": {
    "trqp_conformance_suite": {
      "version": "1.3.0",
      "profile_id": "smoke",
      "run_id": "cts-example-run-1"
    },
    "trqp_tspp": {
      "version": "0.11.0",
      "assurance_level": "AL1",
      "run_id": "tspp-example-run-1"
    }
  },
  "artifacts": [
    {
      "kind": "log",
      "path": "artifacts/conformance-suite-checkout.txt",
      "produced_by": "trqp_conformance_suite",
      "media_type": "text/plain",
      "format": "smoke-v0",
      "notes": "Conformance suite checkout metadata"
    },
    {
      "kind": "log",
      "path": "artifacts/tspp-checkout.txt",
      "produced_by": "trqp_tspp",
      "media_type": "text/plain",
      "format": "smoke-v0",
      "notes": "TSPP checkout metadata"
    }
  ],
  "generator": {
    "name": "trqp-assurance-hub:generate-manifest",
    "version": "0.9.1",
    "uri": "https://github.com/sankarshanmukhopadhyay/trqp-assurance-hub"
  },
  "summary": {
    "overall_status": "pass",
    "conformance_status": "pass",
    "tspp_status": "pass",
    "notes": "Smoke run example \u2014 not a real assurance result.",
    "posture_score": 100.0,
    "coverage_index": 93.33,
    "evidence_completeness": 100.0,
    "assurance_tier": "AL2"
  }
}
